{
  "name": "hermes-tweet",
  "version": "0.1.11",
  "description": "Hermes Agent workflow guide for public X/Twitter research, reading, and approval-gated account actions.",
  "author": {
    "name": "Xquik"
  },
  "homepage": "https://github.com/Xquik-dev/hermes-tweet",
  "repository": "https://github.com/Xquik-dev/hermes-tweet",
  "license": "MIT",
  "keywords": [
    "hermes-agent",
    "twitter",
    "x",
    "social-media",
    "automation"
  ]
}
