{
  "name": "kcc-backlog",
  "version": "0.1.2",
  "description": "Record work items the user wants to defer and recover them later. Default silent — surfaces only on scope-jump detection, slash-command invocation, or skill trigger.",
  "author": { "name": "koh", "email": "koh.718@gmail.com" },
  "homepage": "https://github.com/superkoh/kccplugin",
  "repository": "https://github.com/superkoh/kccplugin.git",
  "license": "MIT",
  "keywords": ["backlog", "tasks", "todo", "defer", "workflow"]
}
