{
  "name": "kcc-dev-core",
  "version": "0.13.0",
  "description": "Development-focused plugin: conditionally injects code-discipline principles when the session is inside a software project (with a subagent variant injected into every spawned subagent), and hosts standalone dev skills (spec, blackbox-tests, unit-tests) and hooks.",
  "author": { "name": "koh", "email": "koh.718@gmail.com" },
  "homepage": "https://github.com/superkoh/kccplugin",
  "repository": "https://github.com/superkoh/kccplugin.git",
  "license": "MIT",
  "keywords": ["dev", "code-discipline", "spec", "black-box-testing", "hooks"]
}
