{
  "name": "kcc-ablation",
  "version": "0.2.0",
  "description": "Prompt-ablation toolkit: measures what each rule in an injected prompt is worth via sealed A/B behavior probes. The ablate skill carries the campaign methodology; the portable mechanics (arm builder, stream-json extractor, run screening, Fisher-exact verdicts, blinded judging) ship as scripts.",
  "author": { "name": "koh", "email": "koh.718@gmail.com" },
  "homepage": "https://github.com/superkoh/kccplugin",
  "repository": "https://github.com/superkoh/kccplugin.git",
  "license": "MIT",
  "keywords": ["ablation", "prompt-engineering", "ab-testing", "evaluation", "probes"]
}
