{
  "name": "kcc-core",
  "version": "0.3.0",
  "description": "Core plugin for the kccplugin marketplace: thinking & communication principles injected at session start.",
  "author": { "name": "koh", "email": "koh.718@gmail.com" },
  "homepage": "https://github.com/superkoh/kccplugin",
  "repository": "https://github.com/superkoh/kccplugin.git",
  "license": "MIT",
  "keywords": ["core", "context", "principles", "thinking"]
}
